{
  "schema_version": "stage13-decision-dossier/v1",
  "status": "recommended_package_pending_alex_approval",
  "created_date": "2026-08-31",
  "implementation_base": "7976c98cc83a6df098ae0ef8c59b56027a7f4899",
  "authority_owner": "Alex",
  "scientific_data": false,
  "production_eligible": false,
  "definitive_execution_started": false,
  "evidence_firewall": {
    "permitted_evidence_used": [
      "accepted red-team amendment and Stage 11 directions",
      "historical Phase I context only where admitted by the protocol",
      "Stage 9 and Stage 10 technical runtime, memory, determinism, and storage evidence",
      "Stage 12 synthetic interface and failure-path validation",
      "documented intended four-day resource envelope, explicitly not a verified grant"
    ],
    "excluded_evidence": [
      "comparative Stage 15 or candidate definitive endpoints",
      "registered-checkpoint exploratory endpoint results",
      "unpublished directional local or chat results",
      "synthetic effect directions",
      "settings selected to strengthen a phase or distillation contrast"
    ],
    "registered_or_private_artifacts_accessed": false
  },
  "approval": {
    "status": "pending",
    "required_approver": "Alex",
    "approved_package_id": null,
    "approval_date": null,
    "approval_text": null,
    "dossier_sha256": null
  },
  "recommended_package_id": "stage13-package-a-conservative-protected/v1",
  "decisions": [
    {
      "decision_id": "RD-001",
      "question": "Which teachers, tasks, phases, and matched-primary inclusion rule define the population?",
      "downstream_consequences": ["population sample size", "teacher and student job counts", "paired phase estimands", "explicit unavailable-cell accounting"],
      "stage11_direction": "Expand beyond five predecessor seeds toward approximately fifteen; Task 1 is protected mod-113 addition, Task 2 is reduced multiplication, and Task 3 is capacity-contingent polynomial breadth.",
      "stage12_evidence": "P1 can construct all three task families, train/resume teachers, apply the historical metric-only phase rule, and emit unavailable cells without scientific execution.",
      "viable_options": [
        {"option": "A", "description": "Fixed seeds 0-14 with no replacement; three metric-selected phases; paired primary uses seeds with both pre and stable-post phases.", "tradeoff": "Exactly prospective and simple, but fewer than 15 matched units if a seed lacks a phase."},
        {"option": "B", "description": "Fixed seeds 0-19 and retain the first 15 complete seeds by seed order.", "tradeoff": "More likely to reach 15 matched units, but adds training and a phase-availability selection layer."},
        {"option": "C", "description": "Retain the five predecessor teachers only.", "tradeoff": "Cheapest but does not repair the red-team population limitation."}
      ],
      "invalid_options": ["replace an unavailable seed after seeing circuit endpoints", "impute a missing phase", "treat the historical 15-cell Stage 3 roster as the new answer", "choose Task 3 from outcome direction"],
      "protected_tier_consequences": {"tier1": "45 fixed Task 1 teacher-phase cells before unavailability; three phases for each of 15 seeds.", "tier2": "Task 2 uses fixed seeds 0-4 at pre and stable-post phases.", "tier3": "Task 3 is the fixed polynomial task and runs only after protected completeness."},
      "recommendation": {
        "option": "A",
        "teacher_seeds": [0, 1, 2, 3, 4, 5, 6, 7, 8, 9, 10, 11, 12, 13, 14],
        "teacher_training": "canonical predecessor architecture and configs/model.yaml plus configs/training.yaml, trained from scratch for at most 40000 updates",
        "phase_rule": "historical-stage3-phase-selection/stage3-frozen/v1 using training metrics only",
        "phases": ["pre-grokking", "50%", "stable post-grokking"],
        "primary_phase_contrast": ["pre-grokking", "stable post-grokking"],
        "matched_primary_rule": "teacher seed must have both primary phase landmarks; the 50% cell may be absent without invalidating the primary pair",
        "replacement_rule": "none",
        "task1": {"family": "modular_addition", "modulus": 113, "domain": "full 113x113"},
        "task2": {"family": "modular_multiplication", "modulus": 59, "domain": "full 59x59", "role": "protected Tier 2 external validity"},
        "task3": {"family": "modular_polynomial", "modulus": 59, "domain": "full 59x59", "formula": "(x^2 + x*y + y^2) mod 59", "role": "optional Tier 3"}
      },
      "rationale": "A fixed roster and algebraically fixed breadth tasks are outcome-independent; 15 teachers directly addresses the population critique while explicit unavailability preserves honesty.",
      "uncertainty": "The fixed roster may yield fewer than 15 matched seeds and Task 2/3 training feasibility remains to be qualified operationally.",
      "amendment_consequence": "Changing seeds, task formula, or matched rule after approval requires a prospective amendment before Stage 15 and invalidates all affected manifest hashes.",
      "requires_alex_choice": true
    },
    {
      "decision_id": "RD-002",
      "question": "Which student architectures and initialization assignments form the canonical and external-validity panel?",
      "downstream_consequences": ["student training volume", "component denominators", "basis compatibility", "conditional architecture summaries"],
      "stage11_direction": "Canonical predecessor-matched architecture plus at most five families in a balanced sparse assignment; no isolated causal architecture claim.",
      "stage12_evidence": "P2 validates injected multi-layer architectures, architecture-bound identities, parameter/component accounting, checkpoint resume, eligibility, and sealing.",
      "viable_options": [
        {"option": "A", "description": "Five-family panel: canonical plus depth, head-granularity, narrow-MLP, and wide-MLP variants; four alternates receive a balanced 12-seed sparse panel.", "tradeoff": "Broad external validity with bounded Tier 2 cost."},
        {"option": "B", "description": "Canonical plus two alternates only.", "tradeoff": "Cheaper but narrower response to the architecture critique."},
        {"option": "C", "description": "Full five-family factorial.", "tradeoff": "Maximum coverage but prohibited and computationally wasteful."}
      ],
      "invalid_options": ["infer architecture from checkpoint shape", "count architectures as population replicates", "full factorial", "reassign after endpoint inspection"],
      "protected_tier_consequences": {"tier1": "Canonical architecture only.", "tier2": "Four alternates, three fixed teacher seeds per alternate, pre/stable phases, both conditions, two eligible students per cell.", "tier3": "Additional architecture-seed crossings only in fixed priority order."},
      "recommendation": {
        "option": "A",
        "architectures": [
          {"id": "predecessor-matched/v1", "n_layers": 1, "d_model": 128, "n_heads": 4, "d_head": 32, "d_mlp": 512, "role": "canonical"},
          {"id": "depth-2-matched-width/v1", "n_layers": 2, "d_model": 128, "n_heads": 4, "d_head": 32, "d_mlp": 512, "role": "alternate"},
          {"id": "heads-8-matched-width/v1", "n_layers": 1, "d_model": 128, "n_heads": 8, "d_head": 16, "d_mlp": 512, "role": "alternate"},
          {"id": "mlp-256-matched-residual/v1", "n_layers": 1, "d_model": 128, "n_heads": 4, "d_head": 32, "d_mlp": 256, "role": "alternate"},
          {"id": "mlp-1024-matched-residual/v1", "n_layers": 1, "d_model": 128, "n_heads": 4, "d_head": 32, "d_mlp": 1024, "role": "alternate"}
        ],
        "tier2_assignment": {"depth-2-matched-width/v1": [0, 4, 8], "heads-8-matched-width/v1": [1, 5, 9], "mlp-256-matched-residual/v1": [2, 6, 10], "mlp-1024-matched-residual/v1": [3, 7, 11]},
        "initialization_rule": "domain-separated seed from full condition identity and fixed initialization slot; no opportunistic substitution"
      },
      "rationale": "The panel varies distinct structural properties, reports exact denominators, and uses fixed sparse assignments rather than pseudo-replication.",
      "uncertainty": "Architecture training eligibility may differ; those differences remain reportable rather than repaired by reassignment.",
      "amendment_consequence": "Any roster or assignment change after approval requires a prospective amendment and re-sealing of affected scientific and manifest profiles.",
      "requires_alex_choice": true
    },
    {
      "decision_id": "RD-003",
      "question": "What exact hard/soft training, eligibility, replication, and failure policy applies?",
      "downstream_consequences": ["eligible model count", "attempt ceiling", "missing student cells", "training compute"],
      "stage11_direction": "Exact hard agreement, gauge-invariant soft matching, unconditional failure accounting, and no imputation.",
      "stage12_evidence": "P2 and Stage 6B/6C implement injected optimizers, exact hard eligibility, centered-logit soft discrepancy, optional argmax requirement, attempts, resume, and failure states. Stage 9 measured deterministic CPU behavior and planning costs but did not freeze policy.",
      "viable_options": [
        {"option": "A", "description": "Three eligible students per Tier 1 cell, six fixed attempts, minimum three; soft centered-logit MSE <=1e-4 plus exact argmax.", "tradeoff": "Strong realization sensitivity and strict functional match, with a maximum of 540 Task 1 attempts."},
        {"option": "B", "description": "Two eligible students, four attempts, minimum two; soft tolerance 1e-3.", "tradeoff": "Lower cost but weaker dispersion estimates and looser soft matching."},
        {"option": "C", "description": "One eligible student per cell.", "tradeoff": "Cannot estimate within-cell realization sensitivity adequately."}
      ],